Question	Answer	Annotation (Label)
Is it because he bribed the district attorney to keep me out of prison?	You know about that?	4
You know about that?	It was a difficult pill to swallow, knowing that my absolution was paid for, accepting a literal get-out-of-jail-free card for the beating of Oscar Rankin.	1
Find something?	Yeah.	1
Think it's some sort of code?	I think the last 13 digits are a bank account, and the first seven are a Swiss routing number.	1
Seriously?	As I said, ripe for reconsideration.	1
You didn't tell her?	Didn't seem relevant when I relayed our progress yesterday.	2
And now I'm sitting in what? What do you call this room? Is this the box?	We call it "Interview One." It's just a good, quiet place to talk.	4
I don't see a judge letting that redacted bank paperwork into trial. Do you? I mean, we can't explain how he got it.	Not yet.	2
You want a piece of our offshore business, you want to pair us up with somebody in Ukraine? Because you can forget about us pulling back in the Jordan Valley.	Oh, I'm sure I'll do plenty of business with Dynastic Energy in the future, Bill.	4
You think we'd be better off starting fresh in the morning?	Men require less sleep than women.	2
If Gagnier used an accomplice to plant the gun, do you really think that person's gonna tell us something that we can use against Wellstone?	It's a long shot that such a person would know of Wellstone's involvement.	2
Would you say that was velvet bentgrass?	That I couldn't tell you.	4
That's you on the right, is it not, Mr. Wellstone? And please confirm that you see the time there-- 12:09 p.m. on the day of the attack.	We can all see that's Mr. Wellstone.	1
So you won't mind if I speak with him?	Did you know you had a predecessor, Lukas? At Interpol.	5